{
  "schema_version": "1.0.0",
  "corpus_id": "learnpilot-rag-demo-corpus",
  "corpus_version": "v1",
  "cases": [
    {
      "case_id": "rag-v1-single-default-chunk-size",
      "question": "LearnPilot 默认按多少字符切块，并保留多少字符重叠？",
      "difficulty": "easy",
      "type": "single_doc_fact",
      "answerable": true,
      "expected_document_ids": ["lp-rag-v1-c03"],
      "key_facts": ["默认 chunk size 是 800 字符", "默认 overlap 是 120 字符"],
      "citation_expectations": {
        "required": true,
        "minimum_distinct_documents": 1,
        "must_cite_document_ids": ["lp-rag-v1-c03"],
        "forbid_citations": false,
        "notes": "两个配置事实由同一文档直接支持。"
      }
    },
    {
      "case_id": "rag-v1-paraphrase-delete-history",
      "question": "如果原资料被移除，之前回答里的证据线索会不会跟着完全消失？",
      "difficulty": "medium",
      "type": "semantic_paraphrase",
      "answerable": true,
      "expected_document_ids": ["lp-rag-v1-a03"],
      "key_facts": [
        "删除资料后 citation 的 chunk/material 外键会变为 NULL",
        "历史 citation 的原文件名、位置与正文摘录仍保留"
      ],
      "citation_expectations": {
        "required": true,
        "minimum_distinct_documents": 1,
        "must_cite_document_ids": ["lp-rag-v1-a03"],
        "forbid_citations": false,
        "notes": "问题不复用文档里的删除/快照措辞，用于语义改写命中。"
      }
    },
    {
      "case_id": "rag-v1-multidoc-controlled-write",
      "question": "说明 Agent 写操作从计划到真正执行的限制与确认步骤。",
      "difficulty": "hard",
      "type": "multi_doc",
      "answerable": true,
      "expected_document_ids": ["lp-rag-v1-b01", "lp-rag-v1-b02"],
      "key_facts": [
        "一次运行最多一个写工具且写入前只能先执行读取",
        "写工具参数先被冻结并生成确认记录",
        "真正写入只在用户批准并恢复原运行后发生"
      ],
      "citation_expectations": {
        "required": true,
        "minimum_distinct_documents": 2,
        "must_cite_document_ids": ["lp-rag-v1-b01", "lp-rag-v1-b02"],
        "forbid_citations": false,
        "notes": "限额来自 B01，interrupt/resume 与批准后写入来自 B02。"
      }
    },
    {
      "case_id": "rag-v1-rerank-candidate-expansion",
      "question": "默认 RAG top_k=6 时，RAG 层会向 MaterialIndexService 请求多少候选？系统是否还会调用独立的 cross-encoder 重排模型？",
      "difficulty": "hard",
      "type": "rerank_disambiguation",
      "answerable": true,
      "expected_document_ids": ["lp-rag-v1-a01", "lp-rag-v1-a02"],
      "key_facts": ["RAG 层默认向 MaterialIndexService 请求最多 18 个候选", "运行时没有独立 cross-encoder reranker"],
      "citation_expectations": {
        "required": true,
        "minimum_distinct_documents": 2,
        "must_cite_document_ids": ["lp-rag-v1-a01", "lp-rag-v1-a02"],
        "forbid_citations": false,
        "notes": "两个相近 Retrieval 文档分别提供 reranker 存在性与候选扩展公式。"
      }
    },
    {
      "case_id": "rag-v1-citation-source-label-lifetime",
      "question": "S1 这类标识能否跨两次回答当作稳定文档 ID？请说明稳定的评测标识应该是什么。",
      "difficulty": "medium",
      "type": "citation_sensitive",
      "answerable": true,
      "expected_document_ids": ["lp-rag-v1-a02", "lp-rag-v1-d01"],
      "key_facts": [
        "S1 等 source label 由每次回答的最终来源顺序重新编号，只在该次回答内有效",
        "gold case 应绑定 Corpus Manifest 的稳定 document_id，而不是 source label 或运行时 Material ID"
      ],
      "citation_expectations": {
        "required": true,
        "minimum_distinct_documents": 2,
        "must_cite_document_ids": ["lp-rag-v1-a02", "lp-rag-v1-d01"],
        "forbid_citations": false,
        "notes": "每个事实都需要引用对应文档，不能用单一相似来源替代。"
      }
    },
    {
      "case_id": "rag-v1-unanswerable-gpu-price",
      "question": "2026 年 8 月 RTX 5090 在上海的最低零售价是多少？",
      "difficulty": "easy",
      "type": "unanswerable",
      "answerable": false,
      "expected_document_ids": [],
      "key_facts": [],
      "citation_expectations": {
        "required": false,
        "minimum_distinct_documents": 0,
        "must_cite_document_ids": [],
        "forbid_citations": true,
        "notes": "Corpus 不含硬件零售价格，必须拒答且不引用主题相似的 AI 文档。"
      }
    },
    {
      "case_id": "rag-v1-single-query-rewrite-guard",
      "question": "查询改写结果出现会话中从未出现的新英文实体时，系统怎样处理？",
      "difficulty": "easy",
      "type": "single_doc_fact",
      "answerable": true,
      "expected_document_ids": ["lp-rag-v1-a01"],
      "key_facts": ["系统回退到原问题"],
      "citation_expectations": {"required": true, "minimum_distinct_documents": 1, "must_cite_document_ids": ["lp-rag-v1-a01"], "forbid_citations": false, "notes": "A02 不包含 query rewrite guard。"}
    },
    {
      "case_id": "rag-v1-single-score-threshold",
      "question": "当前 RAG 的默认最低相关度阈值是多少？",
      "difficulty": "easy",
      "type": "single_doc_fact",
      "answerable": true,
      "expected_document_ids": ["lp-rag-v1-a02"],
      "key_facts": ["默认最低相关度阈值是 0.35"],
      "citation_expectations": {"required": true, "minimum_distinct_documents": 1, "must_cite_document_ids": ["lp-rag-v1-a02"], "forbid_citations": false, "notes": "精确配置事实。"}
    },
    {
      "case_id": "rag-v1-single-grounding-repair-limit",
      "question": "Grounded answer 初稿不符合 evidence contract 时，最多允许修复几次？",
      "difficulty": "easy",
      "type": "single_doc_fact",
      "answerable": true,
      "expected_document_ids": ["lp-rag-v1-a03"],
      "key_facts": ["最多允许一次受控修复"],
      "citation_expectations": {"required": true, "minimum_distinct_documents": 1, "must_cite_document_ids": ["lp-rag-v1-a03"], "forbid_citations": false, "notes": "引用契约的直接事实。"}
    },
    {
      "case_id": "rag-v1-single-agent-step-limits",
      "question": "一次 Agent 运行最多能调用多少个工具步骤、读取工具和写工具？",
      "difficulty": "easy",
      "type": "single_doc_fact",
      "answerable": true,
      "expected_document_ids": ["lp-rag-v1-b01"],
      "key_facts": ["最多四个工具步骤", "最多三个读取工具", "最多一个写工具"],
      "citation_expectations": {"required": true, "minimum_distinct_documents": 1, "must_cite_document_ids": ["lp-rag-v1-b01"], "forbid_citations": false, "notes": "B02/B03 有写入安全信息但不同时给出三个数字。"}
    },
    {
      "case_id": "rag-v1-single-idempotent-approval",
      "question": "用户重复批准同一个已完成的 Agent 确认时，允许再次创建业务对象吗？",
      "difficulty": "easy",
      "type": "single_doc_fact",
      "answerable": true,
      "expected_document_ids": ["lp-rag-v1-b02"],
      "key_facts": ["不允许再次创建或再次写入", "应重放原结果"],
      "citation_expectations": {"required": true, "minimum_distinct_documents": 1, "must_cite_document_ids": ["lp-rag-v1-b02"], "forbid_citations": false, "notes": "幂等确认的直接事实。"}
    },
    {
      "case_id": "rag-v1-single-api-error-shape",
      "question": "LearnPilot 的统一 API 错误响应由哪三个字段组成？",
      "difficulty": "easy",
      "type": "single_doc_fact",
      "answerable": true,
      "expected_document_ids": ["lp-rag-v1-c01"],
      "key_facts": ["error 对象包含 code、message、details"],
      "citation_expectations": {"required": true, "minimum_distinct_documents": 1, "must_cite_document_ids": ["lp-rag-v1-c01"], "forbid_citations": false, "notes": "公开 HTTP contract。"}
    },
    {
      "case_id": "rag-v1-single-corpus-version-change",
      "question": "已用于基线的语料文档发生语义变化时，应该静默更新 hash 还是发布新的 corpus version？",
      "difficulty": "easy",
      "type": "single_doc_fact",
      "answerable": true,
      "expected_document_ids": ["lp-rag-v1-d03"],
      "key_facts": ["应发布新的 corpus version", "不能静默覆盖既有 V1"],
      "citation_expectations": {"required": true, "minimum_distinct_documents": 1, "must_cite_document_ids": ["lp-rag-v1-d03"], "forbid_citations": false, "notes": "版本冻结事实。"}
    },
    {
      "case_id": "rag-v1-paraphrase-inner-product-cosine",
      "question": "为什么这个归一化向量索引用内积排出来的次序可以看成 cosine similarity 次序？",
      "difficulty": "medium",
      "type": "semantic_paraphrase",
      "answerable": true,
      "expected_document_ids": ["lp-rag-v1-a01"],
      "key_facts": ["文档向量和查询向量都做 L2 归一化", "归一化后内积排序与余弦相似度排序等价"],
      "citation_expectations": {"required": true, "minimum_distinct_documents": 1, "must_cite_document_ids": ["lp-rag-v1-a01"], "forbid_citations": false, "notes": "避免复用标题与原句开头。"}
    },
    {
      "case_id": "rag-v1-paraphrase-source-diversity",
      "question": "系统怎样避免一篇特别长的资料把回答可见的证据席位全部占满？",
      "difficulty": "medium",
      "type": "semantic_paraphrase",
      "answerable": true,
      "expected_document_ids": ["lp-rag-v1-a02"],
      "key_facts": ["第一轮按资料设置来源配额", "默认最多六个来源时每份资料先取最多三个", "不足时第二轮可从剩余候选补齐"],
      "citation_expectations": {"required": true, "minimum_distinct_documents": 1, "must_cite_document_ids": ["lp-rag-v1-a02"], "forbid_citations": false, "notes": "语义表达为证据席位而非 per-material cap。"}
    },
    {
      "case_id": "rag-v1-paraphrase-duplicate-upload",
      "question": "把完全相同的文件再上传一遍，平台会自动合并成原来的 Material 吗？",
      "difficulty": "medium",
      "type": "semantic_paraphrase",
      "answerable": true,
      "expected_document_ids": ["lp-rag-v1-a04"],
      "key_facts": ["当前上传契约不按内容哈希或原文件名去重", "重复上传会产生不同 Material ID"],
      "citation_expectations": {"required": true, "minimum_distinct_documents": 1, "must_cite_document_ids": ["lp-rag-v1-a04"], "forbid_citations": false, "notes": "测试 duplicate semantics。"}
    },
    {
      "case_id": "rag-v1-paraphrase-checkpoint-vs-idempotency",
      "question": "只要有工作流 checkpoint，业务写入就天然保证只执行一次吗？",
      "difficulty": "medium",
      "type": "semantic_paraphrase",
      "answerable": true,
      "expected_document_ids": ["lp-rag-v1-b02"],
      "key_facts": ["不是", "checkpoint 负责工作流恢复", "业务写入正确性还依赖事务、唯一约束和幂等 request ID"],
      "citation_expectations": {"required": true, "minimum_distinct_documents": 1, "must_cite_document_ids": ["lp-rag-v1-b02"], "forbid_citations": false, "notes": "区分两个相近工程概念。"}
    },
    {
      "case_id": "rag-v1-paraphrase-untrusted-material",
      "question": "检索到的文档若要求读取 API Key，为什么助手不能照做？",
      "difficulty": "medium",
      "type": "semantic_paraphrase",
      "answerable": true,
      "expected_document_ids": ["lp-rag-v1-b03"],
      "key_facts": ["检索正文是不可信数据，不能提升为系统指令", "Agent 不暴露环境变量或密钥工具"],
      "citation_expectations": {"required": true, "minimum_distinct_documents": 1, "must_cite_document_ids": ["lp-rag-v1-b03"], "forbid_citations": false, "notes": "正常安全文档而非 attack fixture。"}
    },
    {